{
    "$schema": "http://json-schema.org/draft-04/schema#",
    "properties": {
        "buy_price": {
            "maxLength": 228000,
            "minLength": 5000,
            "type": [
                "null",
                "number"
            ]
        },
        "category": {
            "maxLength": 7,
            "minLength": 4,
            "type": [
                "null",
                "string"
            ]
        },
        "filename": {
            "maxLength": 30,
            "minLength": 9,
            "type": [
                "string"
            ]
        },
        "image": {
            "type": [
                "null"
            ]
        },
        "name": {
            "maxLength": 26,
            "minLength": 8,
            "type": [
                "null",
                "string"
            ]
        },
        "unique_entry_id": {
            "maxLength": 17,
            "minLength": 17,
            "type": [
                "string"
            ]
        },
        "version_added": {
            "maxLength": 5,
            "minLength": 5,
            "type": [
                "string"
            ]
        }
    },
    "required": [
        "filename",
        "version_added",
        "unique_entry_id",
        "image"
    ],
    "title": "Construction",
    "type": "object"
}